<?xml version="1.0" encoding="UTF-8" standalone="no" ?>
<!DOCTYPE courses SYSTEM "timetable.dtd">
<courses>
    <course code="BLAW 3600">
        <booking>
            <instructor>Catherine Ryan</instructor>
            <room>SW3 4785</room>
            <bookingtype>Lab</bookingtype>
        </booking>
    </course>

    <course code="COMP 4735">
        <booking>
            <instructor>Mirela Gutica</instructor>
            <room>SW1 1205</room>
            <bookingtype>Lecture</bookingtype>
        </booking>
    </course>

    <course code="COMP 4735">
        <booking>
            <instructor>Mirela Gutica</instructor>
            <room>SE12 320</room>
            <bookingtype>Lab</bookingtype>
        </booking>
    </course>

    <course code="COMP 4735">
        <booking>
            <instructor>Mirela Gutica</instructor>
            <room>SW1 1205</room>
            <bookingtype>Lecture</bookingtype>
        </booking>
    </course>

    <course code="COMP 4977">
        <booking>
            <instructor>D'Arcy Smith</instructor>
            <room>SW12 325</room>
            <bookingtype>Seminar</bookingtype>
        </booking>
    </course>

    <course code="COMP 4560">
        <booking>
            <instructor>Branda Fine</instructor>
            <room>SW5 1850</room>
            <bookingtype>Lecture</bookingtype>
        </booking>
    </course>

    <course code="COMP 4711">
        <booking>
            <instructor>James Parry</instructor>
            <room>SW5 1840</room>
            <bookingtype>Lecture</bookingtype>
        </booking>
    </course>


    <course code="COMP 4560">
        <booking>
            <instructor>Joseph Lo</instructor>
            <room>SE12 322</room>
            <bookingtype>Lab</bookingtype>
        </booking>
    </course>

    <course code="COMP 4711">
        <booking>
            <instructor>James Parry</instructor>
            <room>SE12 320</room>
            <bookingtype>Lab</bookingtype>
        </booking>
    </course>

    <course code="COMP 4976">
        <booking>
            <instructor>Medhat Elmasry</instructor>
            <room>SE12 308</room>
            <bookingtype>Seminar</bookingtype>
        </booking>
    </course>

    <course code="COMP 4735">
        <booking>
            <instructor>Mirela Gutica</instructor>
            <room>SW3 1710</room>
            <bookingtype>Lecture</bookingtype>
        </booking>
    </course>

    <course code="BLAW 3600">
        <booking>
            <instructor>Catherine Ryan</instructor>
            <room>SW5 1840</room>
            <bookingtype>Lecture</bookingtype>
        </booking>
    </course>

    <course code="COMP 4560">
        <booking>
            <instructor>Catherine Ryan</instructor>
            <room>SW3 1750</room>
            <bookingtype>Lecture</bookingtype>
        </booking>
    </course>



</courses>